{
  "schema": "rie.source_record.v1",
  "source_id": "s_qs_comm_001",
  "content_kind": "video",
  "title": "Community Demo Lecture",
  "provenance": { "discovered_from": "https://youtube.com/watch?v=stress1", "retrieved_at_utc": "2026-03-08T00:00:00Z", "canonical_url": "https://youtube.com/watch?v=stress1" },
  "trust_signals": [
    { "schema": "rie.trust_signal.v1", "signal_id": "sig_qs_b", "tier": "C", "kind": "lab_page_linked", "evidence": { "note": "Community educator", "domain": "youtube.com" }, "observed_at_utc": "2026-03-08T00:00:00Z" }
  ]
}
